{
  "schema_version": 1,
  "id": "AVATAR-TOKENS",
  "version": "1.0.0",
  "collections": [
    {
      "id": "avatar",
      "name": "avatar",
      "default_mode": "Contable",
      "modes": [
        {
          "id": "Contable",
          "name": "Contable"
        },
        {
          "id": "Administrativo",
          "name": "Administrativo"
        },
        {
          "id": "Servicios",
          "name": "Servicios"
        },
        {
          "id": "Personas",
          "name": "Personas"
        }
      ]
    },
    {
      "id": "avatar-group",
      "name": "avatar-group",
      "default_mode": "Value",
      "modes": [
        {
          "id": "Value",
          "name": "Value"
        }
      ]
    }
  ],
  "tokens": [
    {
      "id": "avatar.color-bg-primary-default",
      "name": "--avatar-color-bg-primary-default",
      "layer": "component",
      "type": "color",
      "collection": "avatar",
      "scopes": [
        "FRAME_FILL"
      ],
      "description": "avatar: color/bg/primary-default; uso compartido según BH-P07.",
      "values": {
        "Contable": {
          "alias": "semantic.brand-default"
        },
        "Administrativo": {
          "alias": "semantic.brand-administrativo-default"
        },
        "Servicios": {
          "alias": "semantic.brand-servicios-default"
        },
        "Personas": {
          "alias": "semantic.brand-personas-default"
        }
      },
      "source": {
        "path": "evidence/avatar-pilot/source/page-snapshot.json",
        "sha256": "84264381b8a2fc19117a07c9d3d188205b57a070c6c6f6122aa07cb3b11c010d",
        "original_id": "1132:21344",
        "source_file_key": "9zs5RMR8LB5wHjW9Bd59BA",
        "selector": "JSON:/nodes/3"
      }
    },
    {
      "id": "avatar.color-stroke-separator",
      "name": "--avatar-color-stroke-separator",
      "layer": "component",
      "type": "color",
      "collection": "avatar",
      "scopes": [
        "STROKE_COLOR"
      ],
      "description": "avatar: color/stroke/separator; uso compartido según BH-P07.",
      "values": {
        "Contable": {
          "alias": "semantic.neutral-base"
        },
        "Administrativo": {
          "alias": "semantic.neutral-base"
        },
        "Servicios": {
          "alias": "semantic.neutral-base"
        },
        "Personas": {
          "alias": "semantic.neutral-base"
        }
      },
      "source": {
        "path": "evidence/avatar-pilot/source/page-snapshot.json",
        "sha256": "84264381b8a2fc19117a07c9d3d188205b57a070c6c6f6122aa07cb3b11c010d",
        "original_id": "1132:21344",
        "source_file_key": "9zs5RMR8LB5wHjW9Bd59BA",
        "selector": "JSON:/nodes/3"
      }
    },
    {
      "id": "avatar.color-text-inverse",
      "name": "--avatar-color-text-inverse",
      "layer": "component",
      "type": "color",
      "collection": "avatar",
      "scopes": [
        "TEXT_FILL"
      ],
      "description": "avatar: color/text/inverse; uso compartido según BH-P07.",
      "values": {
        "Contable": {
          "alias": "semantic.neutral-base"
        },
        "Administrativo": {
          "alias": "semantic.neutral-base"
        },
        "Servicios": {
          "alias": "semantic.neutral-base"
        },
        "Personas": {
          "alias": "semantic.neutral-base"
        }
      },
      "source": {
        "path": "evidence/avatar-pilot/source/page-snapshot.json",
        "sha256": "84264381b8a2fc19117a07c9d3d188205b57a070c6c6f6122aa07cb3b11c010d",
        "original_id": "1132:21344",
        "source_file_key": "9zs5RMR8LB5wHjW9Bd59BA",
        "selector": "JSON:/nodes/3"
      }
    },
    {
      "id": "avatar.color-icon-inverse",
      "name": "--avatar-color-icon-inverse",
      "layer": "component",
      "type": "color",
      "collection": "avatar",
      "scopes": [
        "SHAPE_FILL"
      ],
      "description": "avatar: color/icon/inverse; uso compartido según BH-P07.",
      "values": {
        "Contable": {
          "alias": "semantic.neutral-base"
        },
        "Administrativo": {
          "alias": "semantic.neutral-base"
        },
        "Servicios": {
          "alias": "semantic.neutral-base"
        },
        "Personas": {
          "alias": "semantic.neutral-base"
        }
      },
      "source": {
        "path": "evidence/avatar-pilot/source/page-snapshot.json",
        "sha256": "84264381b8a2fc19117a07c9d3d188205b57a070c6c6f6122aa07cb3b11c010d",
        "original_id": "1132:21344",
        "source_file_key": "9zs5RMR8LB5wHjW9Bd59BA",
        "selector": "JSON:/nodes/3"
      }
    },
    {
      "id": "avatar.color-bg-status-active",
      "name": "--avatar-color-bg-status-active",
      "layer": "component",
      "type": "color",
      "collection": "avatar",
      "scopes": [
        "FRAME_FILL"
      ],
      "description": "avatar: color/bg/status-active; uso compartido según BH-P07.",
      "values": {
        "Contable": {
          "alias": "semantic.positive-default"
        },
        "Administrativo": {
          "alias": "semantic.positive-default"
        },
        "Servicios": {
          "alias": "semantic.positive-default"
        },
        "Personas": {
          "alias": "semantic.positive-default"
        }
      },
      "source": {
        "path": "evidence/avatar-pilot/source/page-snapshot.json",
        "sha256": "84264381b8a2fc19117a07c9d3d188205b57a070c6c6f6122aa07cb3b11c010d",
        "original_id": "1132:21344",
        "source_file_key": "9zs5RMR8LB5wHjW9Bd59BA",
        "selector": "JSON:/nodes/3"
      }
    },
    {
      "id": "avatar.color-bg-status-busy",
      "name": "--avatar-color-bg-status-busy",
      "layer": "component",
      "type": "color",
      "collection": "avatar",
      "scopes": [
        "FRAME_FILL"
      ],
      "description": "avatar: color/bg/status-busy; uso compartido según BH-P07.",
      "values": {
        "Contable": {
          "alias": "semantic.danger-default"
        },
        "Administrativo": {
          "alias": "semantic.danger-default"
        },
        "Servicios": {
          "alias": "semantic.danger-default"
        },
        "Personas": {
          "alias": "semantic.danger-default"
        }
      },
      "source": {
        "path": "evidence/avatar-pilot/source/page-snapshot.json",
        "sha256": "84264381b8a2fc19117a07c9d3d188205b57a070c6c6f6122aa07cb3b11c010d",
        "original_id": "1132:21344",
        "source_file_key": "9zs5RMR8LB5wHjW9Bd59BA",
        "selector": "JSON:/nodes/3"
      }
    },
    {
      "id": "avatar.color-bg-status-inactive",
      "name": "--avatar-color-bg-status-inactive",
      "layer": "component",
      "type": "color",
      "collection": "avatar",
      "scopes": [
        "FRAME_FILL"
      ],
      "description": "avatar: color/bg/status-inactive; uso compartido según BH-P07.",
      "values": {
        "Contable": {
          "alias": "semantic.neutral-medium"
        },
        "Administrativo": {
          "alias": "semantic.neutral-medium"
        },
        "Servicios": {
          "alias": "semantic.neutral-medium"
        },
        "Personas": {
          "alias": "semantic.neutral-medium"
        }
      },
      "source": {
        "path": "evidence/avatar-pilot/source/page-snapshot.json",
        "sha256": "84264381b8a2fc19117a07c9d3d188205b57a070c6c6f6122aa07cb3b11c010d",
        "original_id": "1132:21344",
        "source_file_key": "9zs5RMR8LB5wHjW9Bd59BA",
        "selector": "JSON:/nodes/3"
      }
    },
    {
      "id": "avatar.border-width-regular",
      "name": "--avatar-border-width-regular",
      "layer": "component",
      "type": "number",
      "collection": "avatar",
      "scopes": [
        "STROKE_FLOAT"
      ],
      "description": "avatar: border/width-regular; uso compartido según BH-P07.",
      "values": {
        "Contable": {
          "alias": "semantic.stroke-xs"
        },
        "Administrativo": {
          "alias": "semantic.stroke-xs"
        },
        "Servicios": {
          "alias": "semantic.stroke-xs"
        },
        "Personas": {
          "alias": "semantic.stroke-xs"
        }
      },
      "source": {
        "path": "evidence/avatar-pilot/source/page-snapshot.json",
        "sha256": "84264381b8a2fc19117a07c9d3d188205b57a070c6c6f6122aa07cb3b11c010d",
        "original_id": "1132:21344",
        "source_file_key": "9zs5RMR8LB5wHjW9Bd59BA",
        "selector": "JSON:/nodes/3"
      }
    },
    {
      "id": "avatar.radius-container",
      "name": "--avatar-radius-container",
      "layer": "component",
      "type": "number",
      "collection": "avatar",
      "scopes": [
        "CORNER_RADIUS"
      ],
      "description": "avatar: radius/container; uso compartido según BH-P07.",
      "values": {
        "Contable": {
          "alias": "semantic.radius-full"
        },
        "Administrativo": {
          "alias": "semantic.radius-full"
        },
        "Servicios": {
          "alias": "semantic.radius-full"
        },
        "Personas": {
          "alias": "semantic.radius-full"
        }
      },
      "source": {
        "path": "evidence/avatar-pilot/source/page-snapshot.json",
        "sha256": "84264381b8a2fc19117a07c9d3d188205b57a070c6c6f6122aa07cb3b11c010d",
        "original_id": "1132:21344",
        "source_file_key": "9zs5RMR8LB5wHjW9Bd59BA",
        "selector": "JSON:/nodes/3"
      }
    },
    {
      "id": "avatar.spacing-none",
      "name": "--avatar-spacing-none",
      "layer": "component",
      "type": "number",
      "collection": "avatar",
      "scopes": [
        "GAP"
      ],
      "description": "avatar: spacing/none; uso compartido según BH-P07.",
      "values": {
        "Contable": {
          "alias": "semantic.spacing-none"
        },
        "Administrativo": {
          "alias": "semantic.spacing-none"
        },
        "Servicios": {
          "alias": "semantic.spacing-none"
        },
        "Personas": {